user_id;username;description;email;password;enabled
1;soilyearly;Empower your learning with custom flashcards.;soilyearly@gmail.com;$2a$11$zEzVjg7FOTMUKElO/EdBIO9JexIeYBLh6k.E4l86vntWO572jePgq;1
2;hotdoglithe;"Join a diverse community of lifelong learners, educators, and students who are actively shaping their educational destiny by crafting bespoke flashcards. Unleash your potential, explore, and learn at your own pace.";hotdoglithe@gmail.com;$2a$11$zEzVjg7FOTMUKElO/EdBIO9JexIeYBLh6k.E4l86vntWO572jePgq;1
3;geneticfair;;geneticfair@gmail.com;$2a$11$zEzVjg7FOTMUKElO/EdBIO9JexIeYBLh6k.E4l86vntWO572jePgq;1
4;sheepfrap;"At our education site, we're not just users; we're the architects of our own education. Discover, create, and succeed with personalized flashcards tailored to your unique learning needs.";sheepfrap@gmail.com;$2a$11$zEzVjg7FOTMUKElO/EdBIO9JexIeYBLh6k.E4l86vntWO572jePgq;1
5;yokeburberry;;yokeburberry@gmail.com;$2a$11$zEzVjg7FOTMUKElO/EdBIO9JexIeYBLh6k.E4l86vntWO572jePgq;0
